{
  "$schema": "https://json-schema.org/draft/2020-12/schema",
  "$id": "https://github.com/vassiliylakhonin/agenda-intelligence-md/schemas/v1/evidence-audit.schema.json",
  "title": "EvidenceAudit",
  "description": "Claim-level evidence audit. Each important claim should be traceable to specific evidence with an explicit support level, uncertainty hook, and risk-if-wrong note. Use the `audit-claims` CLI command or `audit_claims` MCP tool to validate.",
  "x-schema-version": "1",
  "type": "object",
  "additionalProperties": false,
  "required": [
    "claims",
    "evidence"
  ],
  "properties": {
    "topic": {
      "type": "string"
    },
    "claims": {
      "type": "array",
      "minItems": 1,
      "items": {
        "$ref": "#/$defs/claim"
      }
    },
    "evidence": {
      "type": "array",
      "items": {
        "$ref": "#/$defs/evidence_item"
      }
    },
    "unsupported_claims": {
      "type": "array",
      "items": {
        "type": "string"
      },
      "description": "Important claims the analyst could not back with evidence."
    }
  },
  "$defs": {
    "claim": {
      "type": "object",
      "additionalProperties": false,
      "required": [
        "claim_id",
        "claim",
        "support_level"
      ],
      "properties": {
        "claim_id": {
          "type": "string",
          "minLength": 1
        },
        "claim": {
          "type": "string",
          "minLength": 1
        },
        "claim_type": {
          "type": "string",
          "enum": [
            "regulatory_change",
            "regulatory_gap",
            "sanctions_event",
            "geopolitical_event",
            "market_event",
            "industry_response",
            "corporate_disclosure",
            "capability_claim"
          ],
          "description": "Taxonomy label for the claim. regulatory_change: law or regulation adopted, amended, or enforced. regulatory_gap: identified absence or weakness in existing regulation. sanctions_event: sanctions designation, evasion, or enforcement action. geopolitical_event: political decision or conflict development. market_event: price move, trade flow, or commercial development. industry_response: industry adaptation or corporate strategy shift. corporate_disclosure: company filing, statement, or announcement. capability_claim: assertion about technical or operational capability."
        },
        "evidence_ids": {
          "type": "array",
          "items": {
            "type": "string"
          }
        },
        "support_level": {
          "type": "string",
          "enum": [
            "direct",
            "partial",
            "weak",
            "unsupported"
          ]
        },
        "uncertainty": {
          "type": "string",
          "description": "What the analyst is unsure about, even if the claim is supported."
        },
        "risk_if_wrong": {
          "type": "string",
          "description": "Decision-level cost if this claim turns out to be wrong."
        },
        "supporting_quotes": {
          "type": "array",
          "description": "Optional span-level grounding: the specific quote(s) in cited evidence that back this claim. Records which span supports the claim, not just which document. Each entry's evidence_id should be one of this claim's evidence_ids. audit-claims checks the structural link only (flags span_orphans where it is not); it does NOT verify the quote text appears in the source \u2014 that is verify-quotes' job. Neither verifies factual truth.",
          "items": {
            "type": "object",
            "additionalProperties": false,
            "required": [
              "evidence_id",
              "quote"
            ],
            "properties": {
              "evidence_id": {
                "type": "string",
                "minLength": 1
              },
              "quote": {
                "type": "string",
                "minLength": 1
              }
            }
          }
        }
      }
    },
    "evidence_item": {
      "type": "object",
      "additionalProperties": false,
      "required": [
        "evidence_id",
        "source_type"
      ],
      "properties": {
        "evidence_id": {
          "type": "string",
          "minLength": 1
        },
        "name": {
          "type": "string"
        },
        "url": {
          "type": "string"
        },
        "source_type": {
          "type": "string",
          "description": "e.g. official_document, regulator_announcement, news, analyst_report, primary_data, illustrative_placeholder."
        },
        "freshness": {
          "type": "string"
        },
        "supports": {
          "type": "array",
          "items": {
            "type": "string"
          }
        },
        "limits": {
          "type": "array",
          "items": {
            "type": "string"
          }
        },
        "content": {
          "type": "string",
          "description": "Optional source text extract. When present, supporting_quotes are corroborated by matching their text against this content; without a content field, caller-declared quotes count as unverified assertions."
        },
        "text": {
          "type": "string",
          "description": "Alias content field; treated like 'content' for quote corroboration."
        },
        "body": {
          "type": "string",
          "description": "Alias content field; treated like 'content' for quote corroboration."
        },
        "excerpt": {
          "type": "string",
          "description": "Alias content field; treated like 'content' for quote corroboration."
        },
        "quote": {
          "type": "string",
          "description": "Alias content field; treated like 'content' for quote corroboration."
        },
        "snippet": {
          "type": "string",
          "description": "Alias content field; treated like 'content' for quote corroboration."
        },
        "summary": {
          "type": "string",
          "description": "Alias content field; treated like 'content' for quote corroboration."
        },
        "full_text": {
          "type": "string",
          "description": "Alias content field; treated like 'content' for quote corroboration."
        },
        "source_id": {
          "type": "string",
          "description": "Legacy caller source identifier; reference metadata only, not resolved or authenticated and not a substitute for evidence_id."
        }
      }
    }
  }
}
